{
  "$schema": "./filters.schema.json",
  "keywords": [
    "author",
    "book*",
    "signing",
    "poetry",
    "reading",
    "swap",
    "exchange",
    "sale",
    "fiction",
    "romance",
    "novel",
    "release party"
  ],
  "exclude": [
    "pokemon",
    "toddler",
    "children",
    "teen",
    "tween",
    "baby",
    "little ones",
    "storytime",
    "story time",
    "homework",
    "tummy",
    "english conversations",
    "craft lab",
    "ages 1-3",
    "ages 2-5",
    "ages 5-8",
    "ages 5-12",
    "bookmobile",
    "english language learners",
    "therapy dog",
    "therapy dogs",
    "woodshop",
    "by appointment only",
    "BLDG 61",
    "elementary"
  ],
  "fields": [
    "title",
    "description"
  ],
  "caseSensitive": false,
  "wholeWord": false
}